{
  "$schema": "https://json-schema.org/draft/2020-12/schema",
  "$id": "urn:mongo-client-cache:benchmarks:stream-cost:report:v1",
  "title": "Stream cost benchmark report (v1)",
  "type": "object",
  "required": [
    "schema_version",
    "identity",
    "environment",
    "workload",
    "limitations",
    "measurement"
  ],
  "properties": {
    "schema_version": { "const": "1" },
    "identity": {
      "type": "object",
      "required": [
        "revision",
        "library_version",
        "python_version",
        "pymongo_version"
      ],
      "properties": {
        "revision": { "type": "string", "minLength": 1 },
        "library_version": { "type": "string", "minLength": 1 },
        "python_version": { "type": "string", "minLength": 1 },
        "pymongo_version": { "type": "string", "minLength": 1 }
      }
    },
    "environment": {
      "type": "object",
      "required": [
        "mongodb_version",
        "topology",
        "member_count",
        "resource_limits"
      ],
      "properties": {
        "mongodb_version": { "type": "string", "minLength": 1 },
        "topology": { "type": "string", "minLength": 1 },
        "member_count": { "type": "integer", "minimum": 1 },
        "resource_limits": {
          "type": "object",
          "minProperties": 1,
          "additionalProperties": { "type": "string" }
        }
      }
    },
    "workload": {
      "type": "object",
      "required": ["name", "parameters"],
      "properties": {
        "name": { "type": "string", "minLength": 1 },
        "parameters": {
          "type": "object",
          "minProperties": 1,
          "required": ["sample_reads", "sample_writes"],
          "properties": {
            "sample_reads": { "type": "integer", "minimum": 0 },
            "sample_writes": { "type": "integer", "minimum": 0 }
          },
          "additionalProperties": {
            "type": ["string", "number", "boolean", "null"]
          }
        }
      }
    },
    "measurement": {
      "type": "object",
      "required": [
        "wall_seconds",
        "process_cpu_seconds",
        "container_cpu_seconds",
        "direct_path_bytes",
        "warmup",
        "variants",
        "logical_metrics"
      ],
      "properties": {
        "wall_seconds": { "type": "number", "minimum": 0 },
        "process_cpu_seconds": { "type": "number", "minimum": 0 },
        "container_cpu_seconds": { "type": "number", "minimum": 0 },
        "direct_path_bytes": {
          "oneOf": [
            { "type": "null" },
            {
              "type": "object",
              "required": ["sent", "received", "scope"],
              "properties": {
                "sent": { "type": "integer", "minimum": 0 },
                "received": { "type": "integer", "minimum": 0 },
                "scope": { "const": "dedicated direct benchmark path only" }
              },
              "additionalProperties": false
            }
          ]
        },
        "warmup": {
          "type": "object",
          "required": ["admissions", "hits"],
          "properties": {
            "admissions": { "type": "integer", "minimum": 1 },
            "hits": { "type": "integer", "minimum": 1 }
          },
          "additionalProperties": false
        },
        "variants": {
          "type": "array",
          "minItems": 2,
          "maxItems": 2,
          "prefixItems": [
            { "$ref": "#/$defs/rawVariant" },
            { "$ref": "#/$defs/cacheVariant" }
          ]
        },
        "change_stream_cost_comparison": {
          "type": "object",
          "required": ["container_cpu_seconds", "direct_path_bytes"],
          "properties": {
            "container_cpu_seconds": {
              "type": "object",
              "required": ["raw", "cache", "delta_seconds"],
              "properties": {
                "raw": { "type": "number", "minimum": 0 },
                "cache": { "type": "number", "minimum": 0 },
                "delta_seconds": { "type": "number" }
              },
              "additionalProperties": false
            },
            "direct_path_bytes": {
              "type": "object",
              "required": ["available", "raw", "cache", "delta"],
              "properties": {
                "available": { "type": "boolean" },
                "raw": {},
                "cache": {},
                "delta": {}
              },
              "additionalProperties": false,
              "oneOf": [
                {
                  "properties": {
                    "available": { "const": false },
                    "raw": { "type": "null" },
                    "cache": { "type": "null" },
                    "delta": { "type": "null" }
                  }
                },
                {
                  "properties": {
                    "available": { "const": true },
                    "raw": { "$ref": "#/$defs/directPathBytesPair" },
                    "cache": { "$ref": "#/$defs/directPathBytesPair" },
                    "delta": { "$ref": "#/$defs/directPathBytesDelta" }
                  }
                }
              ]
            }
          },
          "additionalProperties": false
        },
        "logical_metrics": {
          "type": "object",
          "required": ["cache", "streams"],
          "properties": {
            "cache": {
              "type": "object",
              "required": [
                "hits",
                "misses",
                "evictions",
                "bypasses",
                "oversized_bypasses",
                "used_bytes",
                "shared_budget_bytes",
                "entry_count"
              ],
              "properties": {
                "hits": { "type": "integer", "minimum": 0 },
                "misses": { "type": "integer", "minimum": 0 },
                "evictions": { "type": "integer", "minimum": 0 },
                "bypasses": { "type": "integer", "minimum": 0 },
                "oversized_bypasses": { "type": "integer", "minimum": 0 },
                "used_bytes": { "type": "integer", "minimum": 0 },
                "shared_budget_bytes": { "type": "integer", "minimum": 1 },
                "entry_count": { "type": "integer", "minimum": 0 }
              },
              "additionalProperties": false
            },
            "streams": {
              "type": "array",
              "items": {
                "type": "object",
                "required": [
                  "database",
                  "stream_polls",
                  "logical_event_bytes",
                  "invalidations",
                  "invalidation_lag_windows",
                  "invalidation_lag_clock_skew_limitation",
                  "resident_bytes",
                  "resident_bytes_scope"
                ],
                "properties": {
                  "database": { "type": "string", "minLength": 1 },
                  "stream_polls": { "type": "integer", "minimum": 0 },
                  "logical_event_bytes": { "type": "integer", "minimum": 0 },
                  "invalidations": { "type": "integer", "minimum": 0 },
                  "invalidation_lag_windows": {
                    "type": "array",
                    "items": { "type": "array", "items": { "type": "number" } }
                  },
                  "invalidation_lag_clock_skew_limitation": {
                    "type": "string",
                    "minLength": 1
                  },
                  "resident_bytes": { "type": "integer", "minimum": 0 },
                  "resident_bytes_scope": { "type": "string", "minLength": 1 }
                },
                "additionalProperties": false
              }
            }
          },
          "additionalProperties": false
        }
      },
      "additionalProperties": false
    },
    "limitations": {
      "type": "array",
      "items": {
        "type": "object",
        "required": ["label", "description"],
        "properties": {
          "label": { "type": "string", "minLength": 1 },
          "description": { "type": "string", "minLength": 1 }
        }
      }
    }
  },
  "$defs": {
    "distribution": {
      "type": "object",
      "required": [
        "operation",
        "outcome",
        "sample_count",
        "p50_seconds",
        "p95_seconds",
        "p99_seconds"
      ],
      "properties": {
        "operation": { "type": "string", "minLength": 1 },
        "outcome": { "type": "string", "minLength": 1 },
        "sample_count": { "type": "integer", "minimum": 1 },
        "p50_seconds": { "type": "number", "minimum": 0 },
        "p95_seconds": { "type": "number", "minimum": 0 },
        "p99_seconds": { "type": "number", "minimum": 0 }
      },
      "additionalProperties": false
    },
    "variant": {
      "type": "object",
      "required": [
        "name",
        "operation_count",
        "no_latency_samples",
        "by_outcome"
      ],
      "properties": {
        "name": { "type": "string" },
        "operation_count": { "type": "integer", "minimum": 0 },
        "no_latency_samples": { "type": "boolean" },
        "by_outcome": {
          "type": "array",
          "items": { "$ref": "#/$defs/distribution" }
        }
      },
      "additionalProperties": false,
      "oneOf": [
        {
          "properties": {
            "operation_count": { "const": 0 },
            "no_latency_samples": { "const": true },
            "by_outcome": { "maxItems": 0 }
          }
        },
        {
          "properties": {
            "operation_count": { "minimum": 1 },
            "no_latency_samples": { "const": false },
            "by_outcome": { "minItems": 1 }
          }
        }
      ]
    },
    "rawVariant": {
      "allOf": [
        { "$ref": "#/$defs/variant" },
        { "properties": { "name": { "const": "raw" } } }
      ]
    },
    "cacheVariant": {
      "allOf": [
        { "$ref": "#/$defs/variant" },
        { "properties": { "name": { "const": "cache" } } }
      ]
    },
    "directPathBytesPair": {
      "type": "object",
      "required": ["sent", "received"],
      "properties": {
        "sent": { "type": "integer", "minimum": 0 },
        "received": { "type": "integer", "minimum": 0 }
      },
      "additionalProperties": false
    },
    "directPathBytesDelta": {
      "type": "object",
      "required": ["sent", "received"],
      "properties": {
        "sent": { "type": "integer" },
        "received": { "type": "integer" }
      },
      "additionalProperties": false
    }
  }
}
