{
  "environment": {
    "member_count": 1,
    "mongodb_version": "8.0.4",
    "resource_limits": {
      "cpus": "1.0",
      "memory": "1g"
    },
    "topology": "isolated single-member replica set"
  },
  "identity": {
    "library_version": "0.1.0",
    "pymongo_version": "4.18.1",
    "python_version": "3.14.6",
    "revision": "3db4883"
  },
  "limitations": [
    {
      "description": "CPU is measured for the isolated MongoDB container on this host.",
      "label": "container-cpu"
    },
    {
      "description": "Logical event bytes describe decoded events, not wire traffic.",
      "label": "logical-bytes"
    },
    {
      "description": "Raw event delivery lag includes server-to-host clock skew.",
      "label": "clock-skew"
    }
  ],
  "measurement": {
    "container_cpu_seconds": 0.020063000000000053,
    "direct_path_bytes": null,
    "logical_metrics": {
      "cache": {
        "bypasses": 0,
        "entry_count": 67,
        "evictions": 0,
        "hits": 35,
        "misses": 67,
        "oversized_bypasses": 0,
        "shared_budget_bytes": 67108864,
        "used_bytes": 134536
      },
      "streams": [
        {
          "database": "stream_cost_read_heavy-medium",
          "invalidation_lag_clock_skew_limitation": "raw invalidation-delivery-lag values include unmeasured clock offset between the mongod that originated the event and the observing host; they are not a substitute for a same-clock, single-host latency measurement",
          "invalidation_lag_windows": [],
          "invalidations": 10,
          "logical_event_bytes": 3810,
          "resident_bytes": 134536,
          "resident_bytes_scope": "manager-wide resident bytes across the shared LRU budget; not scoped to a single namespace, collection, or stream",
          "stream_polls": 11
        }
      ]
    },
    "process_cpu_seconds": 0.03884466200000003,
    "variants": [
      {
        "by_outcome": [
          {
            "operation": "read",
            "outcome": "raw",
            "p50_seconds": 0.00016050300109782256,
            "p95_seconds": 0.00023326500013354234,
            "p99_seconds": 0.00029397999969660304,
            "sample_count": 100
          },
          {
            "operation": "write",
            "outcome": "shared_write",
            "p50_seconds": 0.0020438829997146968,
            "p95_seconds": 0.004054625000208034,
            "p99_seconds": 0.004054625000208034,
            "sample_count": 10
          }
        ],
        "name": "raw",
        "no_latency_samples": false,
        "operation_count": 110
      },
      {
        "by_outcome": [
          {
            "operation": "read",
            "outcome": "hit",
            "p50_seconds": 6.449299871746916e-5,
            "p95_seconds": 9.286100066674408e-5,
            "p99_seconds": 9.90270000329474e-5,
            "sample_count": 34
          },
          {
            "operation": "read",
            "outcome": "miss",
            "p50_seconds": 0.0002697119998629205,
            "p95_seconds": 0.00043207100134168286,
            "p99_seconds": 0.0005362100000638748,
            "sample_count": 66
          },
          {
            "operation": "write",
            "outcome": "shared_write",
            "p50_seconds": 0.0020438829997146968,
            "p95_seconds": 0.004054625000208034,
            "p99_seconds": 0.004054625000208034,
            "sample_count": 10
          }
        ],
        "name": "cache",
        "no_latency_samples": false,
        "operation_count": 110
      }
    ],
    "wall_seconds": 0.08932346300025529,
    "warmup": {
      "admissions": 1,
      "hits": 1
    }
  },
  "schema_version": "1",
  "workload": {
    "name": "read_heavy-medium",
    "parameters": {
      "document_count": 100,
      "document_size_profile": "medium",
      "sample_reads": 100,
      "sample_writes": 10,
      "seed": 4,
      "warmup_reads": 2,
      "warmup_writes": 0
    }
  }
}
